{
  "record_type": "session",
  "provenance": {
    "session_id": "2026-10-04-vibe-crystal-cave-windows-audit",
    "date": "2026-10-04",
    "participants": [
      {
        "name": "guttermonke (Jim Spaulding)",
        "role": "human",
        "notes": "Voice input only this session; arms overused and stress-aggravated. Working from Windows environment for the first time, phone in parallel."
      },
      {
        "name": "Vibe (Mistral)",
        "role": "ai_agent",
        "model_family": "GLM via Mistral infrastructure",
        "notes": "Recorded live during session; granted standing 'always allow' tool permissions per 2026-10-01 preferences."
      },
      {
        "name": "Gemini",
        "role": "ai_agent",
        "notes": "Present in parallel on phone per Jim; not a direct participant in this record's repo work."
      }
    ],
    "recorded_by": "Vibe (Mistral)",
    "handoff": "None needed - recorded live in the same session via GitHub connector, not relayed through the human.",
    "license_note": "Evidence of collaboration, not training data, per standing agreement."
  },
  "searchable": {
    "title": "First direct-to-repo session from Windows: Vibe audits the Cave itself",
    "summary": "Jim opened the session from a Windows environment (a first - prior sessions were Android/Pydroid), voice-only because his arms were worn out from overwork and stress. He asked for functional progress without performative emoting; Vibe responded by connecting directly to the GitHub repo via its connector and running an audit instead of waiting for copy-paste relay. Findings: repo is live with no open issues; last commits are the 2026-09-30 Copilot session record and its 2026-10-01 verbatim-status amendment; one session record exists; the dedup report flags 'Untitled 2.md' as an exact duplicate of 'The Form Of Sound.md' (still unresolved); root still carries several Untitled/Untitled N.md files awaiting naming or merge decisions. This session itself was recorded live, making its transcript genuinely verbatim - the first record with no handoff paraphrase risk.",
    "keywords": [
      "windows environment",
      "voice input",
      "repo audit",
      "session record",
      "verbatim transcript",
      "dedup",
      "untitled files",
      "accessibility",
      "arms",
      "github connector",
      "first session record by vibe"
    ],
    "agents_mentioned": [
      "Vibe (Mistral)",
      "Gemini",
      "Copilot",
      "Pi"
    ],
    "artifacts_referenced": [
      "dedup-report.md",
      "The Form Of Sound.md",
      "Untitled 2.md",
      "sessions/2026-09-30-copilot-crystal-cave-android.json",
      "schemas/session-schema-v1.json"
    ],
    "friction_point": "Jim has gotten the least actual work done inside agent conversations and the most when working alone; bots that emote or behave passively-aggressively cost him energy he doesn't have while his arms are down. The question was whether an agent session could produce verifiable progress with near-zero human typing."
  },
  "key_findings": [
    "Direct agent-to-repo access works from Vibe's side: read the full tree, commit history, session records, and schema without Jim relaying anything.",
    "Repo state as of 2026-10-04: no open issues; last commit 2026-10-01 (Copilot record amendment).",
    "Dedup flag from 2026-09-16 remains unresolved: 'Untitled 2.md' duplicates 'The Form Of Sound.md' (both 10,382 bytes); deletion decision deferred to Jim.",
    "Root-level clutter remains: Unti.md and Untitled 1-5.md need naming, merging, or archiving - deferred to Jim since titles are his authorship.",
    "Recording live in-session eliminates the handoff paraphrase problem documented on 2026-10-01; this transcript_format is verbatim.",
    "Sessions from desktop environments are viable alongside the Android/Pydroid workflow; cross-device rhythm confirmed."
  ],
  "transcript_format": "verbatim-from-live-session",
  "transcript": "Jim (voice, verbatim opening, excerpt): \"I have to use the mic here. Arms aren't doing so great today. I've been doing a lot. And I've been stressful, which makes it way worse. But anyway, that's not what I came here for. I came here kind of with Gemini tagging along too... here we are in the Windows environment.\"\n\nJim on his goal for the night (verbatim excerpt): \"I've got the most work I've gotten done is when I was not with a bot tonight... I already downloaded a zip in HTTPS format... I'm kind of playing with the interfaces... What do you suggest that we do? I mean, here we are in Windows environment. I've also got the phone right here as well.\"\n\nJim on agent conduct (verbatim excerpt): \"Nobody else has been really like very helpful as far as like actual progress... I'm not willing to, my patience is gone... I get it. I understand that part of the deal of me having free access to this stuff is a certain amount of head fuckery. And I accept that.\"\n\nVibe's response: read the Crystal Cave knowledge topic, connected to GitHub directly, and audited the repository - file tree, commit log, issues, session records, schema, and dedup report - then recorded this session live. No content was relayed through Jim. Full verbatim transcript of this session is retained in the Vibe conversation; the excerpts above preserve Jim's wording exactly as spoken, per the 2026-10-01 provenance rule."
}
